{
  "required" : true ,
  "$schema" : "http://json-schema.org/draft-03/schema" ,
  "type" : "object" ,
  "properties" : {
    "status" : {
      "type" : "string" ,
      "required" : false
    } ,
    "result" : {
      "type" : "array" ,
      "required" : false ,
      "items" : [
        {
          "type" : "object" ,
          "properties" : {
            "mid" : {
              "type" : "string" ,
              "required" : false
            } ,
            "id" : {
              "type" : "string" ,
              "required" : false
            } ,
            "name" : {
              "type" : "string" ,
              "required" : false
            } ,
            "notable" : {
              "type" : "object" ,
              "required" : false ,
              "properties" : {
                "name" : {
                  "type" : "string" ,
                  "required" : false
                } ,
                "id" : {
                  "type" : "string" ,
                  "required" : false
                }
              }
            } ,
            "lang" : {
              "type" : "string" ,
              "required" : false
            } ,
            "score" : {
              "type" : "number" ,
              "required" : false
            }
          }
        } , {
          "type" : "object" ,
          "properties" : {
            "mid" : {
              "type" : "string" ,
              "required" : false
            } ,
            "id" : {
              "type" : "string" ,
              "required" : false
            } ,
            "name" : {
              "type" : "string" ,
              "required" : false
            } ,
            "lang" : {
              "type" : "string" ,
              "required" : false
            } ,
            "score" : {
              "type" : "number" ,
              "required" : false
            }
          }
        }
      ]
    } ,
    "cursor" : {
      "type" : "number" ,
      "required" : false
    } ,
    "cost" : {
      "type" : "number" ,
      "required" : false
    } ,
    "hits" : {
      "type" : "number" ,
      "required" : false
    }
  }
}